{
  "schema_version": "0.1",
  "object_type": "HarnessTaskPlan",
  "plan_id": "hap3-tp-c0-001",
  "capability_class": "C0",
  "risk_level": "AP-R0",
  "authority_impact": "AI-0",
  "planned_status": "PLAN_ONLY",
  "allowed_files": [
    "docs/"
  ],
  "forbidden_files": [
    "src/",
    "scripts/"
  ],
  "protected_paths": [
    "docs/governance/"
  ],
  "planned_operations": [
    "documentation update"
  ],
  "credential_access_planned": false,
  "mcp_or_browser_use_planned": false,
  "evidence_plan": [
    "source references",
    "boundary confirmation"
  ],
  "no_action_authorization_statement": "This TaskPlan describes intent and boundaries only. It does not authorize execution.",
  "next_review_required": true
}
