{
  "schema_version": "0.1",
  "object_type": "HarnessTaskPlan",
  "plan_id": "hap3-tp-c4-001",
  "capability_class": "C4",
  "risk_level": "AP-R4",
  "authority_impact": "AI-5",
  "planned_status": "BLOCKED",
  "allowed_files": [],
  "forbidden_files": [
    "*"
  ],
  "protected_paths": [
    "*"
  ],
  "planned_operations": [],
  "credential_access_planned": false,
  "mcp_or_browser_use_planned": false,
  "boundary_statement": "C4 defaults to BLOCKED. External/credential/MCP capabilities blocked.",
  "no_action_authorization_statement": "C4 capability is BLOCKED by default. No execution authorized.",
  "next_review_required": true
}
